<?xml version="1.0" encoding="UTF-8"?>
<tns:defenceRequest xmlns:tns="http://ws.sdt.moj.gov.uk/2013/sdt/DefenceFeedbackRequestSchema" xmlns:tns1="http://ws.sdt.moj.gov.uk/2013/sdt/BaseSchema" xmlns:xsi="http://www.w3.org/2001/XMLSchema-instance" xsi:schemaLocation="http://ws.sdt.moj.gov.uk/2013/sdt/DefenceFeedbackRequestSchema ../../../../../main/resources/xsd/DefenceRequestResponse/DefenceFeedbackRequest.xsd ">
  <tns:header>
    <tns:sdtCustomerId>123445678</tns:sdtCustomerId>
    <tns:targetApplicationId>mcol11</tns:targetApplicationId>
  </tns:header>
  <tns:criteria>
    <tns:mcolDefence>
      <tns:fromDate>200221-01-101</tns:fromDate>
      <tns:toDate>200122-01-011</tns:toDate>
    </tns:mcolDefence>
  </tns:criteria>
</tns:defenceRequest>
